<?xml version="1.0" encoding="UTF-8"?>
<ORGANISME xmlns:xsi="http://www.w3.org/2001/XMLSchema-instance" xsi:noNamespaceSchemaLocation="schema.xsd">
    <AGENCES>
    <AGENCE>
        <NOM>Club aventure</NOM>
        <ADRESSE>
            <AVENUE>67 Rue Saint-Jacques</AVENUE>
            <CODE_POSTAL>75005</CODE_POSTAL>
            <VILLE>PARIS</VILLE>
            <PAYS>FRANCE</PAYS>
        </ADRESSE>
        <SEJOURS>
            <SEJOUR type="colonies de vacances">
                <NOM>Séjour au japan</NOM>
                <TYPES_PUBLIC>
                    <TYPE_PUBLIC>adultes</TYPE_PUBLIC>
                    <TYPE_PUBLIC>adolescents</TYPE_PUBLIC>
                </TYPES_PUBLIC>
                <DESCRIPTION>Venez améliorer votre niveau de japonais et découvrir la culture japonaise lors de notre colonie de vacances à Tokyo ! 
                    &#xA; Pendant deux semaines, vous suivrez des cours de japonais le matin et participerez à des activités culturelles l'après-midi. &#xA; Logement en chambres partagées, encadrement assuré pour les jeunes de 14 à 18 ans. Inscrivez-vous dès maintenant !</DESCRIPTION>
                <TARIF>500$</TARIF>
                <ACTIVITEES>
                    <ACTIVITEE type="Sport">
                        <DESCRIPTION>Initiation à l'aïkido, art martial japonais basé sur la défense et le contrôle de l'adversaire</DESCRIPTION>
                    </ACTIVITEE>
                    <ACTIVITEE type="Sport">
                        <DESCRIPTION>Randonnée dans les montagnes environnantes de Tokyo pour profiter de la nature et de la vue sur la ville</DESCRIPTION>
                    </ACTIVITEE>
                    <ACTIVITEE type="Culture">
                        <DESCRIPTION>Atelier de calligraphie japonaise pour apprendre à écrire des kanjis (caractères japonais)</DESCRIPTION>
                    </ACTIVITEE>
                    <ACTIVITEE type="Culture">
                        <DESCRIPTION>Visite du musée Edo-Tokyo pour découvrir l'histoire de Tokyo</DESCRIPTION>
                    </ACTIVITEE>
                </ACTIVITEES>
                <SESSIONS>
                    <SESSION id="s_1">
                        <DEBUT>2023-03-30</DEBUT>
                        <FIN>2023-04-15</FIN>
                        <PARTICIPANTS>
                            <PERSONNELS>
                                <ENSEIGNANTS>
                                    <ENSEIGNANT_REF idref="e_1" />
                                    <ENSEIGNANT_REF idref="e_2" />
                                </ENSEIGNANTS>
                                <ACCOMPAGNATEURS>
                                    <ACCOMPAGNATEUR_REF idref="a_1"/>
                                    <ACCOMPAGNATEUR_REF idref="a_2" />
                                </ACCOMPAGNATEURS>
                            </PERSONNELS>
                            <CLIENTS>
                               <CLIENT_REF idref="cl_1"/> 
                               <CLIENT_REF idref="cl_2"/> 
                               <CLIENT_REF idref="cl_3"/> 
                               <CLIENT_REF idref="cl_4"/> 
                               <CLIENT_REF idref="cl_5"/> 
                               <CLIENT_REF idref="cl_6"/> 
                               <CLIENT_REF idref="cl_7"/> 
                               <CLIENT_REF idref="cl_8"/> 
                               <CLIENT_REF idref="cl_9"/> 
                               <CLIENT_REF idref="cl_10"/> 
                            </CLIENTS>
                        </PARTICIPANTS>
                    </SESSION>
                    <SESSION id="s_2">
                      <DEBUT>2023-01-03</DEBUT>
                      <FIN>2023-01-15</FIN>
                      <PARTICIPANTS>
                          <PERSONNELS>
                              <ENSEIGNANTS>
                                  <ENSEIGNANT_REF idref="e_3" />
                              </ENSEIGNANTS>
                              <ACCOMPAGNATEURS>
                                  <ACCOMPAGNATEUR_REF idref="a_3"/>
                                  <ACCOMPAGNATEUR_REF idref="a_4" />
                              </ACCOMPAGNATEURS>
                          </PERSONNELS>
                          <CLIENTS>
                            <CLIENT_REF idref="cl_6"/> 
                            <CLIENT_REF idref="cl_7"/> 
                            <CLIENT_REF idref="cl_8"/> 
                            <CLIENT_REF idref="cl_9"/> 
                            <CLIENT_REF idref="cl_10"/> 
                            <CLIENT_REF idref="cl_11"/> 
                            <CLIENT_REF idref="cl_12"/> 
                            <CLIENT_REF idref="cl_13"/> 
                            <CLIENT_REF idref="cl_14"/> 
                            <CLIENT_REF idref="cl_15"/> 
                          </CLIENTS>
                      </PARTICIPANTS>
                  </SESSION>
                </SESSIONS>
                <DESTINATIONS>
                    <DESTINATION_REF idref="d_2" />
                </DESTINATIONS>
                <LANGUES_ENSEIGNEES>
                    <LANGUE_ENSEIGNEE idref="l_8">
                        <COURS>
                            <NOM>Initiation à la langue japonaise : Ecrit ET Oral</NOM>
                            <CHAPITRES>
                                <CHAPITRE id="c_1">
                                    <TITRE>initiation aux lettres japonais</TITRE>
                                    <CONTENU> Les lettres japonaises comprennent trois types d'écriture : les kanjis, les hiraganas et les katakanas. 
                                        Les kanjis sont des caractères d'origine chinoise qui représentent des mots ou des idées, tandis que les hiraganas et les katakanas sont des syllabaires japonais. 
                                        Les hiraganas sont utilisés pour les mots courants, tandis que les katakanas sont souvent utilisés pour les mots étrangers ou pour transcrire des noms propres.
                                         L'initiation aux lettres japonaises peut inclure l'apprentissage de l'alphabet hiragana et katakana, 
                                         ainsi que la pratique de l'écriture des kanjis.</CONTENU>
                                </CHAPITRE>
                                <CHAPITRE id="c_2">
                                    <TITRE>communication</TITRE>
                                    <CONTENU> Pour bien communiquer en japonais, il est important d'apprendre les expressions courantes utilisées dans la vie quotidienne et de comprendre les particularités de la langue japonaise. 
                                        Par exemple, au Japon, il est courant d'utiliser des suffixes pour montrer le niveau de respect ou d'affection que l'on porte à une personne. 
                                        Ainsi, on peut ajouter le suffixe "-san" après le nom d'une personne pour montrer du respect, ou le suffixe "-chan" pour montrer de l'affection.</CONTENU>
                                </CHAPITRE>
                            </CHAPITRES>
                        </COURS>
                        <TEST>
                            <NOM> test de niveau Japonais pour les débutants</NOM>
                            <QUESTIONS>
                                <QUESTION type ="avec choix">
                                    <CONTENU>Quel est le nom des trois types d'écriture utilisés en japonais ?</CONTENU>
                                    <LISTE_CHOIX>
                                        <CHOIX>Kanjis, hiraganas, katakanas</CHOIX>
                                        <CHOIX> Romajis, hiraganas, katakanas</CHOIX>
                                        <CHOIX>Kanjis, romajis, hiraganas</CHOIX>
                                    </LISTE_CHOIX>
                                    <POINTS>5</POINTS>
                                    <CHAPITRE_REF idref="c_1" />
                                </QUESTION>
                                <QUESTION type="libre">
                                   <CONTENU>Quels sont les expressions courantes en japonais ?</CONTENU>
                                    <POINTS>5</POINTS>
                                    <CHAPITRE_REF idref="c_1"/>
                                </QUESTION>
                            </QUESTIONS>
                        </TEST>
                    </LANGUE_ENSEIGNEE>
                </LANGUES_ENSEIGNEES>
                <LISTE_AVIS>
                    <AVIS>
                        <NOTE>10</NOTE>
                        <COMMENTAIRE>EXCELLENT VOYAGE</COMMENTAIRE>
                        <DATE>2020-10-10</DATE>
                        <SESSION_REF idref="s_1" />
                        <CLIENT_REF idref="cl_1"></CLIENT_REF>
                    </AVIS>
                    <AVIS>
                      <NOTE>8</NOTE>
                      <COMMENTAIRE>WOW !!</COMMENTAIRE>
                      <DATE>2020-10-11</DATE>
                      <SESSION_REF idref="s_1" />
                      <CLIENT_REF idref="cl_2"></CLIENT_REF>
                  </AVIS>
                </LISTE_AVIS>
            </SEJOUR>

            <SEJOUR type="groupes scolaires">
            <NOM>Séjour en Italie</NOM>
              <TYPES_PUBLIC>
                  <TYPE_PUBLIC>adolescents</TYPE_PUBLIC>
                  <TYPE_PUBLIC>adultes</TYPE_PUBLIC>
              </TYPES_PUBLIC>
              <DESCRIPTION>Partez en séjour linguistique en Italie pour apprendre l'italien dans deux villes magnifiques : Milan et Rome ! 
                Ce séjour est spécialement conçu pour les étudiants qui souhaitent améliorer leur niveau d'italien tout en découvrant la culture italienne.